<?xml version="1.0" encoding="UTF-8" ?>
<!DOCTYPE configuration PUBLIC "-//xipintech.com//code generator//CN" "http://xipintech.com:8081/dtd/generator-config.dtd" >
<configuration>
	<property name="targetProject" value="D:/xpworkspace/xipin-projectframework"></property>
	<!-- 数据库驱动 -->
	<property name="driverClass" value="com.mysql.jdbc.Driver"></property>
	<!-- 数据库连接字符串 -->
	<property name="connectionURL" value="jdbc:mysql://127.0.0.1:3306/owl"></property>
	<!-- 数据库用户名 -->
	<property name="userName" value="root"></property>
	<!-- 数据库密码 -->
	<property name="password" value="123456"></property>
	<!-- 实体的包名 -->
	<property name="entityPackageName" value="com.xipin.projectframework.spi.log.domain"></property>
	<!-- mapper的包名 -->
	<property name="mapperPackageName" value="com.xipin.projectframework.dal.mapper.log"></property>
	<!-- service的包名 -->
	<property name="servicePackageName" value="com.xipin.projectframework.spi.log.service"></property>
	<!-- serviceImpl的包名 -->
	<property name="serviceImplPackageName" value="com.xipin.projectframework.log.service.impl"></property>
	<!-- controller的包名 -->
	<property name="controllerPackageName" value="com.xipin.projectframework.log.web.controller"></property>
	<!-- baseMapper的包名 -->
	<property name="baseMapperPackageName" value="com.xipin.base.dal.mapper"></property>
	<!-- baseService的包名 -->
	<property name="baseServicePackageName" value="com.xipin.base.service"></property>
	<!-- baseServiceImpl的包名 -->
	<property name="baseServiceImplPackageName" value="com.xipin.base.service.impl"></property>
	<!-- baseContoller的包名 -->
	<property name="baseContollerPackageName" value="com.xipin.base.web.controller"></property>
	
	<classPathEntry location="D:\xipin_work\repository\mybatis-generator\code-generator\code-generator\lib\mysql-connector-java-5.1.34-bin.jar"/>
	<jdbcConnection driverClass="${driverClass}" connectionURL="${connectionURL}" userId="${userName}" password="${password}" >
		<property name="remarksReporting" value="true"/>
	</jdbcConnection>
	<templates overwrite="true" makeDirIfNotExist="true" tplDirectory="D:\xipin_work\repository\mybatis-generator\code-generator\code-generator\src\main\resources\template2">
		<template targetDirectory="D:\xpworkspace\xipin-projectframework\xipin-projectframework-spi\src\main\java\com\xipin\projectframework\spi\log\domain" fileNamePrefix="" fileNameSuffix="" tplFile="model.ftl" fileType="java"></template>
		<template targetDirectory="D:\xpworkspace\xipin-projectframework\xipin-projectframework-spi\src\main\java\com\xipin\projectframework\spi\log\service" fileNamePrefix="" fileNameSuffix="Service" tplFile="service.ftl" fileType="java"></template>
		<template targetDirectory="D:\xpworkspace\xipin-projectframework\xipin-projectframework-service\src\main\java\com\xipin\projectframework\log\service\impl" fileNamePrefix="" fileNameSuffix="ServiceImpl" tplFile="serviceImpl.ftl" fileType="java"></template>
		<template targetDirectory="D:\xpworkspace\xipin-projectframework\xipin-projectframework-web\src\main\java\com\xipin\projectframework\log\web\controller" fileNamePrefix="" fileNameSuffix="Controller" tplFile="controller.ftl" fileType="java"></template>
		<template targetDirectory="D:\xpworkspace\xipin-projectframework\xipin-projectframework-dal\src\main\java\com\xipin\projectframework\dal\mapper\log" fileNamePrefix="" fileNameSuffix="Mapper" tplFile="jMapper.ftl" fileType="java"></template>
		<template targetDirectory="D:\xpworkspace\xipin-projectframework\xipin-projectframework-dal\src\main\resources\mapper\log" fileNamePrefix="" fileNameSuffix="Mapper" tplFile="mapper.ftl" fileType="xml"></template>
	</templates>
	<tables schema="test" forceBigDecimals="false" containsView="true" exclude="sys_*" include="log,bas_area"/>
</configuration>